id,answer_type,string,keywords
265,number,How many Golden Globe awards did the husband of Katie Holmes win?,"husband of Katie Holmes win, Golden Globe awards"
266,resource,Are the Rosetta Stone and the Gayer-Andersen cat exhibited in the same museum?,"Gayer-Andersen cat, Rosetta Stone, museum"
267,resource,In which city was the mother of Bill Gates born?,"city, mother of Bill Gates, born"
268,resource,What eating disorder is characterized by an appetite for substances such as clay and sand?,"appetite, substances, clay"
269,string,Lost in Translation,Translation
270,resource,Which movie established a second carrier for Bill Murray?,"carrier, Bill Murray"
271,resource,Which anti-apartheid revolutionary was born in Mvezo?,"anti-apartheid revolutionary, Mvezo"
272,resource,In which town was the man convicted of killing Martin Luther King born?,"man, Martin Luther King, town, killed"
273,resource,Under which king did the British prime minister that had a reputation as a playboy serve?,"reputation, British prime minister, king,  playboy serve"
274,number,How old was Steve Job's sister when she first met him?,"Steve Job's sister, old, meet"
275,date,When was the the greatest composer of Italian opera after Verdi born?,"greatest composer of Italian opera, Verdi"
276,resource,Who composed the music for the film that depicts the early life of Jane Austen?,"early life of Jane Austen, film, music"
277,resource,Which writers had influenced the philosopher that refused a Nobel Prize?,"philosopher, Nobel Prize"
278,resource,Who composed the music for the film that depicts the early life of Jane Austin?,"early life of Jane Austin, film, music"
279,string,Under which pseudonym did Charles Dickens write some of his books?,"Charles Dickens, pseudonym"
280,resource,Which princess died in a car crash in Paris?,"car crash, princess"
281,resource,Which birds are protected under the National Parks and Wildlife Act?,"National Parks, Wildlife Act"
282,resource,List all the battles fought by the lover of Cleopatra.,"battles, lover of Cleopatra"
283,resource,Who is the founder of the Turkish Republic?,"founder, Turkish Republic"
284,resource,Which buildings owned by the crown overlook the North Sea?,"crown, North Sea"
285,resource,Which of the volcanoes that erupted in 1550 is still active?,"volcanoes, active"
286,resource,"Where was the \""Father of Singapore\"" born?","Father of Singapore,born"
287,resource,Who was the president of the USSR during the cold war?,"USSR, cold war, president"
288,resource,What is the birth place of Hollywood's highest-paid actress?,birth place of Hollywood's highest-paid actress
289,resource,Where was the first race for the greatest Formula One driver of all times?,"greatest Formula, driver, race"
290,resource,Who is the wife of the creator of the César Award?,"creator, César Award"
291,resource,Who were generals of the battle of gettysburg?,"generals, battle of gettysburg"
292,resource,In which city where Charlie Chaplin's half brothers born?,"Charlie Chaplin's half brothers, city"
293,resource,Who was the mayor of London during the olympic games?,"mayor of London, olympic games"
294,resource,Who is the architect of the tallest building in Japan?,"architect, tallest building,japan"
295,resource,In which city does the sports commentator know as Memory Man live?,"sports commentator, Memory Man, city"
296,date,When was the European President known as the decider born?,"European President, decider"
297,number,How old was Steve Jobs' sister when she first met him?,"Steve Jobs' sister, old, meet"
298,resource,Who was vice president under the president who approved the use of atomic weapons against Japan during World War II?,"vice president, Japan, use of atomic weapons, World War ii"
299,resource,What eating disorder is characterized by eating substances such as clay and sand?,"substances, clay, sand"
300,resource,Who first deciphered the Egyptian hieroglyphs?,"Egyptian hieroglyphs, deciphered "
301,resource,In which city does the former main presenter of the Xposé girls live?,"main presenter, Xposé girls, city"
302,resource,In which town was the assassin of Martin Luther King born?,"assassin of Martin Luther King, town, assasain"
303,boolean,Did Robin Cook attend a university?,"Robin Cook, attend, university"
304,boolean,Did Tony Fry influence Aristotle?,"Tony Fry, influence, Aristotle"
305,boolean,Does Por tu amor have more episodes than Game of Thrones?,"Por tu amor, more, episodes, Game of Thrones"
306,boolean,Does the Alba River flow into a lake?,"Alba River, flow, lake"
307,resource,From which region is the Refosco dal Peduncolo Rosso?,"region, Refosco dal Peduncolo Rosso"
308,resource,Give me all Avant-garde jazz record labels.,Avant-garde jazz record labels
309,resource,Give me all books written by David Foster Wallace.,"books, written, David Foster Wallace"
310,resource,Give me all cars that are produced in Netherlands.,"cars, produced, Netherlands"
311,resource,Give me all companies in Jena.,"companies, Jena"
312,resource,Give me all inflows of the Lake Houston.,"inflows, Lake Houston"
313,resource,Give me all members of The Who.,"members, The Who"
314,resource,Give me all professional skateboarders from Sweden.,"professional, skateboarders, Sweden"
315,resource,Give me all soccer clubs in Qatar.,"soccer clubs, Qatar"
316,resource,Give me all video games published by Black Isle Studios.,"video games, published, Black Isle Studios"
317,resource,Give me the children of David Foster.,"children, David Foster"
318,string,Give me the homepage of Metropolitan Home.,"homepage, Metropolitan Home"
319,number,How big is the Mammoth Pool Reservoir?,"big, Mammoth Pool Reservoir"
320,number,How deep is Steinsee?,"deep, Steinsee"
321,number,How high is the Doe Hill Mountain?,"high, Doe Hill Mountain"
322,number,How high is the Volcano Mountain?,"high, Volcano Mountain"
323,number,How high is the Landegode Lighthouse?,"high, Landegode Lighthouse"
324,number,How many employees does Staedtler have?,"many, employees, Staedtler"
325,number,How many ethnic groups live in Spain?,"ethnic groups, live, Spain"
326,number,How many inhabitants does Nagamangala have?,"inhabitants, Nagamangala"
327,number,How many museums does Sofia have?,"museums, Sofia"
328,number,How many pages does The Man with the Red Tattoo have?,"pages, The Man with the Red Tattoo"
329,number,How many people live in the capital of Togo?,"people, live, capital, Togo "
330,number,How many politicians graduated from Stanford University?,"politicians, graduated, Stanford University"
331,number,How many scientists graduated from Washburn University?,"scientists, graduated, Washburn University"
332,number,How many students does the Texas Tech University have?,"students, Texas Tech University"
333,number,How much did Vanilla Sky cost?,"Vanilla Sky, cost"
334,number,How often did Teresa Mo marry?,"Teresa Mo, marry"
335,number,How tall is John Windsor?,"tall, John Windsor"
336,number,How tall is Kate Upton?,"tall, Kate Upton"
337,resource,In which country is Solaize located?,"country, Solaize, located"
338,resource,In which country is the Tasman Lake?,"country, Tasman Lake"
339,resource,In which country is the Tiefer See?,"country, Tiefer See"
340,resource,In which programming language is QuickTime written?,"programming language, QuickTime, written"
341,boolean,Is Campari a beverage?,"Campari, beverage"
342,boolean,Is Lisa Guerrero a model?,"Lisa Guerrero, model"
343,boolean,Is Sol Tax a scientist?,"Sol Tax, scientist"
344,boolean,Is Joe Biden a democrat?,"Joe Biden, democrat"
345,boolean,Is David Macaulay still alive?,"David Macaulay, alive"
346,boolean,Is Wilma Flintstone married?,"Wilma Flintstone, married"
347,boolean,Is there a video game called Flappy Bird?,"video, game, called, Flappy Bird"
348,resource,Show me everyone who was born on Boxing Day.,"born, Boxing_Day"
349,boolean,Was Peter Isola a chemist?,"Peter Isola, chemist"
350,boolean,Was Denis Dutton born in Sioux City?,"Denis Dutton, born, Sioux City"
351,boolean,Was Vannes Wu born in Aachen-Mitte?,"Vanness Wu, born, Aachen-Mitte"
352,boolean,Was the band Led Zeppelin founded before DJ Tomekk was born?,"band, Led Zeppelin, founded, DJ Tomekk, born"
353,boolean,Was the band ZZ Top founded before Macklemore was born?,"band, ZZ Top, founded, Macklemore, born"
354,resource,What are the official languages of Tunisia?,"official, languages, Tunisia"
355,string,What is the area code of Aegina?,"area code, Aegina"
356,resource,What is the capital of Venezuela?,"capital, Venezuela"
357,resource,What is the currency of Rhodesia?,"currency, Rhodesia"
358,string,What is the eye color of Liza Kennedy?,"eye color, Liza Kennedy"
359,string,What is the hair color of Marlon Teixeira?,"hair color, Marlon Teixeira"
360,string,What is the official color of the Carleton University?,"official color, Carleton University"
361,resource,What is the ruling party in Lo Espejo?,"ruling party, Lo Espejo"
362,date,When did Jules Bergman die?,"Jules Bergman, die"
363,date,When did Red Sonja's creator die?,"Red Sonja, creator die"
364,date,When is Gibraltar Diamond Jubilee Flotilla?,Gibraltar Diamon Jubilee Flotilla
365,date,When was Sevcon founded?,"Sevcon, founded"
366,date,When was Albert Schweitzer born?,"Albert Schweitzer, born"
367,number,When was the Cobble Hill Tunnel built?,"Cobble Hill Tunnel, built"
368,number,When was the Riverdale Monument built?,"Riverdale Monument, built"
369,date,When was the Operation Purple Haze?,Operation Purple Haze
370,resource,Where did Queen Emma of Hawaii  die?,"Queen Emma of Hawaii , die"
371,resource,Where is the Sandhammaren located?,"Sandhammaren, located"
372,resource,Which airports are located in Chios?,"airports, located, Chios"
373,resource,Which artist made the album Old School Prankstas?,"artist, made, album, Old School Prankstas"
374,resource,Which books were published by DAW Books?,"books, published, DAW Books"
375,resource,Which bridges cross the Prut?,"bridges, cross, Prut"
376,resource,Which instruments does Courtney Love play?,"instruments, Courtney Love, play"
377,resource,Which languages are spoken in Romania?,"languages, spoken, Romania"
378,resource,Which museum exhibits The Skater?,"museum, exhibits, The Skater"
379,resource,Which music albums contain the song Into Your Arms?,"music albums, contain, song, Into Your Arms"
380,resource,Which organizations were founded in 1918?,"organizations, founded, 1918"
381,resource,Which presidents were born in 1891?,"presidents, born, 1891"
382,resource,Which professional surfers were born in Australia?,"professional surfers, born, Australia"
383,resource,Who created Retrocrush?,"created, Retrocrush"
384,resource,Who created Miss Marple?,"created, Miss Marple"
385,resource,Who created the comic Old Man Logan?,"created, comic, Old Man Logan"
386,resource,Who designed the Langebro?,"designed, Langebro"
387,resource,Who developed Quake engine?,"developed, Quake engine"
388,resource,Who developed the video game Duke Nukem 3D?,"developed, video game, Duke Nukem 3D"
389,resource,Who founded Sony?,"founded, Sony"
390,resource,Who is the editor of Semana?,"editor, Semana"
391,resource,Who is the founder of DC Comics?,"founder, DC Comics"
392,resource,Who is the heaviest player of the ASK Riga?,"heaviest, player, ASK Riga"
393,resource,Who is the manager of Gazelle FC?,"manager, Gazelle FC"
394,resource,Who is the mayor of Virar?,"mayor, Virar"
395,resource,Who is the mayor of the capital of New Caledonia?,"mayor, capital, New Caledonia"
396,resource,Who is the owner of Mazda?,"owner, Mazda"
397,resource,Who is the tallest player of Udinese Calcio?,"tallest, player, Udinese Calcio"
398,resource,Who is the youngest Snooker player?,"youngest, Snooker player"
399,resource,Who painted Unfinished portrait of General Bonaparte?,"painted, Unfinished portrait of General Bonaparte"
400,resource,Who produces Red Bull?,"produces, Red Bull"
401,resource,Who were the parents of Maria of Antioch?,"parents, Maria of Antioch"
402,resource,Who wrote the book Leave It to Psmith?,"wrote, book, Leave It to Psmith"
403,date,When was the Battle of Gettysburg?,Battle of Gettysburg
404,resource,List all the musicals with music by Elton John.,"musicals, music by, Elton John"
405,number,How high is the lighthouse in Colombo?,"high, lighthouse in Colombo"
406,resource,Who was the wife of U.S. president Lincoln?,"U.S. president, Lincoln, wife"
407,resource,Who is the host of the BBC Wildlife Specials?,"host, BBC Wildlife Specials"
408,number,How much did Pulp Fiction cost?,"cost, Pulp Fiction"
409,resource,In what city is the Heineken brewery?,"city, Heineken brewery"
410,date,When did Operation Overlord commence?,"when, Operation Overlord, commence"
411,resource,In which city does the Chile Route 68 end?,"city, Chile Route 68, ends"
412,resource,Who developed Slack?,"developer, Slack"
413,resource,Who was married to president Chirac?,"married to, president Chirac"
414,resource,What did Bruce Carver die from?,"Bruce Carver, die"
415,resource,Who painted The Storm on the Sea of Galilee?,"The Storm on the Sea of Galilee, paint"
416,resource,Which cities does the Weser flow through?,"Weser, flow through, city"
417,resource,How many seats does the home stadium of FC Porto have?,"How many seats, stadium of FC Porto"
418,resource,Who is the daughter of Robert Kennedy married to?,"Robert Kennedy, daughter, married"
419,resource,Which books by Kerouac were published by Viking Press?,"book, Kerouac, publish, Viking Press"
420,number,How tall is Amazon Eve?,"Amazon Eve, tall"
421,resource,Which museum exhibits The Scream by Munch?,"museum, Scream, Munch"
422,resource,Who wrote the book Les Piliers de la terre?,"wrote, book, The pillars of the Earth"
423,boolean,Is James Bond married?,"James Bond, married"
424,resource,Who discovered Ceres?,"discoverer, Ceres"
425,resource,Which river does the Brooklyn Bridge cross?,"river, cross, Brooklyn Bridge"
426,resource,Who was called Frank The Tank?,"called, Frank The Tank"
427,resource,What is the largest country in the world?,"largest country, world"
428,resource,Who is the mayor of Paris?,"mayor, Paris"
429,resource,Who is the coach of Ankara's ice hockey team?,"coach, ice hockey team, Ankara"
430,resource,Who is the mayor of the capital of French Polynesia?,"mayor, capital, French Polynesia"
431,resource,Which awards did Douglas Hofstadter win?,"Douglas Hofstadter, award"
432,string,How much did the Lego Movie cost?,"Lego Movie, cost"
433,resource,Where does Piccadilly start?,"Piccadilly, start"
434,boolean,Do Prince Harry and Prince William have the same parents?,"Prince Harry, Prince William, same, parents"
435,resource,Who played Agent Smith in Matrix?,"played, Agent Smith, Matrix"
436,number,How many languages are spoken in Turkmenistan?,"languages, Turkmenistan"
437,resource,In which films did Julia Roberts as well as Richard Gere play?,"film, play, Julia Roberts, Richard Gere"
438,resource,In which country does the Ganges start?,"Ganges, start, country"
439,date,In which year was Rachel Stevens born?,"year, born, Rachel Stevens"
440,boolean,Is Barack Obama a democrat?,"Barack Obama, democrat"
441,resource,Where was Bach born?,"birthplace, Bach"
442,number,How often did Jane Fonda marry?,"Jane Fonda, marry, how often"
443,resource,Who was the first to climb Mount Everest?,"first, climb, mount Everest"
444,number,How many people live in Poland?,"How many people, Poland"
445,resource,What is the location of the Houses of Parliament?,"location, Houses of Parliament"
446,boolean,Is Christian Bale starring in Batman Begins?,"Christian Bale, starring, Batman Begins"
447,resource,In which country is the Limerick Lake?,"Limerick Lake, country"
448,resource,What was the last movie with Alec Guinness?,"Alec Guinness, last, movie"
449,resource,What is the highest mountain in Australia?,"Australia, highest mountain"
450,boolean,Is Frank Herbert still alive?,"Frank Herbert, alive"
451,resource,Who created Family Guy?,"create, Family Guy"
452,resource,What is the official language of Suriname?,"Suriname, official language"
453,resource,Who wrote the song Hotel California?,"write, song, Hotel California"
454,resource,Give me all actors starring in movies directed by William Shatner.,"actor, starring, movie, direct, William Shatner"
455,resource,What is in a chocolate chip cookie?,"ingredients, chocolate chip cookie"
456,resource,Give me all professional skateboarders from Sweden.,"professional, skateboarder, Sweden"
457,resource,Which ingredients do I need for carrot cake?,"carrot cake, ingredients"
458,resource,Does Neymar play for Real Madrid?,"Neymar, play, Real Madrid"
459,resource,Which computer scientist won an oscar?,"computer scientist, win, oscar"
460,number,How many companies were founded in the same year as Google?,"companies, founded, same year, Google"
461,resource,In which UK city are the headquarters of the MI6?,"MI6, headquarters, city, UK"
462,boolean,Was the Cuban Missile Crisis earlier than the Bay of Pigs Invasion?,"Cuban Missile Crisis, earlier, Bay of Pigs Invasion"
463,resource,What does IYCM stand for?,"IYCM, stand for"
464,date,When did the Ming dynasty dissolve?,"dissolve, Ming dynasty"
465,resource,List all episodes of the first season of the HBO television series The Sopranos!,"HBO, television series, Sopranos, first season, episode"
466,number,"What is the total population of Melbourne, Florida?","total population, Melbourne Florida"
467,boolean,Did Arnold Schwarzenegger attend a university?,"Arnold Schwarzenegger, attend, university"
468,resource,What country is Mount Everest in?,"country, Mount Everest"
469,resource,What is the largest city in Australia?,"Australia, largest city"
470,resource,Give me all launch pads operated by NASA.,"launch pad, operate, NASA"
471,resource,Who is the mayor of Tel Aviv?,"Tel Aviv, mayor"
472,resource,List all episodes of the first season of the HBO television series The Sopranos.,"HBO, television series, Sopranos, first season, episode"
473,resource,Who created Batman?,"Batman, creator"
474,resource,Who played Gus Fring in Breaking Bad?,"play, Gus Fring, Breaking Bad"
475,resource,In which programming language is GIMP written?,"GIMP, programming language"
476,resource,In which ancient empire could you pay with cocoa beans?,"ancient empire, pay, cocoa beans"
477,resource,Who is the editor of Forbes?,"Forbes, editor"
478,number,How many people live in the capital of Australia?,"Australia, capital, people, live"
479,resource,Which professional surfers were born in Australia?,"professional surfer, born, Australia"
480,resource,Which electronics companies were founded in Beijing?,"electronics companies, founded, Beijing"
481,resource,Give me all video games published by Mean Hamster Software.,"video game, publish, Mean Hamster Software"
482,number,How many Aldi stores are there?,"own, Aldi"
483,resource,What is the capital of Cameroon?,"capital, Cameroon"
484,boolean,Is there a video game called Battle Chess?,"video game, Battle Chess"
485,boolean,Was the wife of president Lincoln called Mary?,"Lincoln, president, wife, called, Mary"
486,resource,Give me all movies directed by Francis Ford Coppola.,"movie, direct, Francis Ford Coppola"
487,resource,Which of Tim Burton's films had the highest budget?,"highest budget, film, Tim Burton"
488,boolean,Does Breaking Bad have more episodes than Game of Thrones?,"Breaking Bad, episodes, more than, Game of Thrones"
489,resource,Who was called Rodzilla?,"called, Rodzilla"
490,boolean,Was Natalie Portman born in the United States?,"Natalie Portman, born, United States"
491,resource,Give me the grandchildren of Elvis Presley.,"Elvis Presley, grandchildren"
492,resource,Which movies starring Mickey Rourke were directed by Guy Ritchie?,"movies, starring, Mickey Rourke, directed, Guy Ritchie"
493,resource,When did Dracula's creator die?,"Dracula, creator, die"
494,resource,Which country does the creator of Miffy come from?,"Miffy, creator, country"
495,string,What is Batman's real name?,"real name, Batman"
496,resource,What form of government does Russia have?,"form of government, Russia"
497,number,How many companies were founded by the founder of Facebook?,"companies, founded by, founder, Facebook"
498,resource,Give me all Canadian Grunge record labels.,"record label, Canadian, Grunge"
499,number,How many children did Benjamin Franklin have?,"Benjamin Franklin, child"
500,resource,List the children of Margaret Thatcher.,"Margaret Thatcher, child"
501,resource,From which region is the Melon de Bourgogne?,"region, Melon de Bourgogne"
502,resource,Who is the oldest child of Meryl Streep?,"oldest child, Meryl Streep"
503,boolean,Are tree frogs a type of amphibian?,"tree frog, amphibian"
504,boolean,Is Christian Bale starring in Velvet Goldmine?,"Christian Bale, starring, Velvet Goldmine"
505,resource,List all games by GMT.,"game, GMT"
506,boolean,Does the Isar flow into a lake?,"Isar, flow, lake"
507,resource,Which airports does Yeti Airlines serve?,"airports, Yeti Airlines"
508,resource,Which Indian company has the most employees?,"Indian company, the most employees"
509,resource,What color expresses loyalty?,"color, express, loyalty"
510,resource,Which city has the most inhabitants?,"city, the most inhabitants"
511,resource,Who created Wikipedia?,"Wikipedia, created"
512,boolean,Is Rita Wilson the wife of Tom Hanks?,"Rita Wilson, wife, Tom Hanks"
513,boolean,Is the wife of president Obama called Michelle?,"Obama, president, wife, called, Michelle"
514,number,How many ethnic groups live in Slovenia?,"how many, ethnic groups, Slovenia"
515,resource,Who is the president of Eritrea?,"president, Eritrea"
516,resource,Which films did Stanley Kubrick direct?,"film, Stanley Kubrick, direct"
517,date,When was the Titanic completed?,"Titanic, completion date"
518,resource,How many pages does War and Peace have?,"how many, pages, War and Peace"
519,resource,Who is the youngest player in the Premier League?,"player, Premier League, youngest"
520,resource,What is the highest mountain in Italy?,"highest, mountain, Italy"
521,number,How tall is Claudia Schiffer?,"Claudia Schiffer, tall"
522,resource,Who was John F. Kennedy's vice president?,"John F. Kennedy, vice president"
523,resource,Which subsidiary of Lufthansa serves both Dortmund and Berlin Tegel?,"subsidiary, Lufthansa, serve, Dortmund, Berlin Tegel"
524,resource,Who was the successor of John F. Kennedy?,"John F. Kennedy, successor"
525,resource,Who composed the soundtrack for Cameron's Titanic?,"compose, soundtrack, Cameron's Titanic"
526,resource,Which movies did Kurosawa direct?,"film, direct, Kurosawa"
527,resource,For which label did Elvis record his first album?,"Elvis, first, album, label"
528,resource,In which time zone is Rome?,"time zone, Rome"
529,resource,Give me the currency of China.,"currency, China"
530,resource,Who are the developers of DBpedia?,"developers, DBpedia"
531,boolean,Does Abraham Lincoln's death place have a website?,"Abraham Lincoln, death place, website"
532,resource,Who is the king of the Netherlands?,"king, the Netherlands"
533,resource,In which city did Nikos Kazantzakis die?,"city, Nikos Kazantzakis, die"
534,resource,Who was the father of Queen Elizabeth II?,"father, Queen Elizabeth II"
535,resource,Give me a list of all critically endangered birds.,"list, critically endangered birds"
536,number,How many inhabitants does the largest city in Canada have?,"inhabitants, largest city, Canada"
537,resource,In which military conflicts did Lawrence of Arabia participate?,"Lawrence of Arabia, military conflict"
538,resource,Which book has the most pages?,"book, the most pages"
539,resource,In which country does the Nile start?,"Nile, start, country"
540,resource,Who is the Formula 1 race driver with the most races?,"Formula 1, race driver, races, most"
541,resource,Which companies produce hovercrafts?,"companies, produce, hovercrafts"
542,boolean,Did Elvis Presley have children?,"Elvis Presley, children"
543,resource,In which city was the president of Montenegro born?,"city, born, president of Montenegro"
544,resource,Which country was Bill Gates born in?,"country, born, Bill Gates"
545,resource,In which countries do people speak Japanese?,"which countries, speak, Japanese"
546,resource,Show me the book that Muhammad Ali wrote.,"book, wrote, Muhammad Ali"
547,boolean,Is Michelle Obama the wife of Barack Obama?,"Michelle Obama, wife, Barack Obama"
548,number,What is the area code of Berlin?,"Berlin, area code"
549,resource,Give me all actors starring in Last Action Hero.,"actor, starring, Last Action Hero"
550,string,What are the nicknames of San Francisco?,"San Francisco, nickname"
551,resource,What was the first Queen album?,"first album, Queen"
552,resource,Through which countries does the Yenisei river flow?,"Yenisei river, flow through, country"
553,resource,Which television shows were created by Walt Disney?,"television show, create, Walt Disney"
554,resource,What is the bridge with the longest span?,"bridge, longest span"
555,resource,What country is Sitecore from?,"country, Sitecore"
556,resource,Whom did Lance Bass marry?,"wife, Lance Bass"
557,resource,What is the capital of Canada?,"capital, Canada"
558,resource,Who was Vincent van Gogh inspired by?,"person, inspiring, Vincent van Gogh"
559,resource,In which city did John F. Kennedy die?,"city, John F. Kennedy, die"
560,boolean,Was U.S. president Jackson involved in a war?,"U.S. president, Jackson, war"
561,resource,Who wrote the Game of Thrones theme?,"writer, Game of Thrones"
562,resource,Who designed the Brooklyn Bridge?,"Brooklyn Bridge, design"
563,date,When did Boris Becker end his active career?,"Boris Becker, end career"
564,resource,Which types of grapes grow in Oregon?,"grape types, grow, Oregon"
565,number,How tall is Michael Jordan?,"tall, Michael Jordan"
566,resource,To which party does the mayor of Paris belong?,"party, mayor, Paris, belong"
