id,answer_type,string,keywords
567,resource,Who wrote the book The Pillars of the Earth?,"wrote, book, The pillars of the Earth"
568,resource,Who was the 16th president of the United States?,"United States, 16th president"
569,number,How high is the Mount Everest?,"Mount Everest, high"
570,resource,Who was the doctoral supervisor of Albert Einstein?,"doctoral supervisor, Albert Einstein"
571,resource,In which city does Sylvester Stallone live?,"city, live, Sylvester Stallone"
572,resource,What is the currency of the Czech Republic?,"Czech republic, currency"
573,boolean,Did Socrates influence Aristotle?,"Socrates, influence, Aristotle"
574,resource,What is the time zone of Salt Lake City?,"Salt Lake City, time zone"
575,resource,Who is the son of Sonny and Cher?,"son, Sonny and Cher"
576,resource,In which city are the headquarters of the United Nations?,"city, headquarters of the United Nations"
577,resource,Who is the founder of Penguin Books?,"founder, Penguin Books"
578,date,When was Jack Wolfskin founded?,"Jack Wolfskin, founded"
579,resource,Who is the mayor of Rotterdam?,"mayor, Rotterdam"
580,resource,Give me all Swedish oceanographers.,"Swedish, oceanographer"
581,resource,Show me Hemingway's autobiography.,"autobiography, Hemingway"
582,resource,Who are the parents of the wife of Juan Carlos I?,"Juan Carlos I, wife, parents"
583,boolean,Did Tesla win a nobel prize in physics?,"Tesla, nobel prize, physics"
584,resource,Who is the tallest basketball player?,"tallest, basketball player"
585,resource,Which city has the least inhabitants?,"city, the least inhabitants"
586,boolean,Is proinsulin a protein?,"proinsulin, protein"
587,resource,Who were the parents of Queen Victoria?,"parents, Queen Victoria"
588,boolean,Did Che Guevara have children?,"children, Che Guevara"
589,boolean,Is Lake Baikal bigger than the Great Bear Lake?,"Lake Baikal, bigger than, Great Bear Lake"
590,boolean,Did Kaurismäki ever win the Grand Prix at Cannes?,"Kaurismäki, winner, Grand Prix at Cannes"
591,resource,Give me all books by William Goldman with more than 300 pages.,"book, William Goldman, pages, more than 300"
592,resource,Where is Fort Knox located?,"Fort Knox, located"
593,resource,In which U.S. state is Fort Knox located?,"Fort Knox, located, U.S. state"
594,resource,Where is Syngman Rhee buried?,"where, Syngman Rhee, buried"
595,resource,What is the timezone in San Pedro de Atacama?,"timezone, San Pedro de Atacama"
596,resource,To which artistic movement did the painter of The Three Dancers belong?,"artistic movement, painter, The Three Dancers"
597,resource,Which scientist is known for the Manhattan Project and the Nobel Peace Prize?,"scientist, known for, Manhattan Project, Nobel Peace Prize"
598,resource,Show me all books in Asimov's Foundation series.,"books, Asimov, Foundation series"
599,resource,Give me all cities in New Jersey with more than 100000 inhabitants.,"New Jersey, city, inhabitants, more than 100000"
600,resource,Which museum in New York has the most visitors?,"museum, New York, the most visitors"
601,number,How high is the Yokohama Marine Tower?,"high, Yokohama Marine Tower"
602,boolean,Does the new Battlestar Galactica series have more episodes than the old one?,"new BattleStar Galactica series, episodes, more, old Battle Star Galactica series"
603,resource,Who is the youngest Darts player?,"Darts player, youngest"
604,resource,Who developed the video game World of Warcraft?,"video game, World of Warcraft, develop"
605,resource,Who was the pope that founded the Vatican Television?,"pope, founded, Vatican Television"
606,resource,Who composed the music for Harold and Maude?,"Harold and Maude, compose, music"
607,resource,Give me all members of Prodigy.,"member, Prodigy"
608,resource,Who is starring in Spanish movies produced by Benicio del Toro?,"starring, Spanish movies, produced, Benicio del Toro"
609,resource,Which subsidiary of TUI Travel serves both Glasgow and Dublin?,"subsidiary, TUI Travel, serve, Glasgow, Dublin"
610,resource,In which country is Mecca located?,"country, located, Mecca"
611,number,How many languages are spoken in Colombia?,"languages, Colombia"
612,resource,What is the biggest stadium in Spain?,"biggest stadium, Spain"
613,resource,Which professional surfers were born on the Philippines?,"professional surfer, born, Philippines"
614,resource,What are the five boroughs of New York?,"five boroughs, New York"
615,boolean,Is Cola a beverage?,"Cola, beverage"
616,date,When did princess Diana die?,"date, princess Diana, died"
617,resource,Where in France is sparkling wine produced?,"produced, France, sparkling wine"
